Title,Date
Tensions Rise Between Student Activists and Senior Administration Over Housing,2019/10/12
Letter to the Editor: More than just displacement: the housing crisis and its debilitating effects,2019/09/26
Dozens of students displaced due to on-campus housing issues,2019/09/18
Affordable housing proposals cause for debate in the town of Wellesley,2018/04/25
Office of Residential Life announces changes to the housing process,2018/02/21
New housing process introduced at Wellesley,2017/02/25
College revamps housing registration process,2016/11/17
Off-campus housing diversifies students’ residential and social experiences,2016/10/27
Co-housing caters to the modern family,2016/10/19
Wellesley students scramble to find housing upon returning from study abroad,2016/02/03
